{
 "assetVersion": 1,
 "id": "tile-0087",
 "pack": "kenney-tiny-dungeon",
 "file": "tile-0087.png",
 "sha256": "07688a4e629ec88985b1cabd92fbb40818ee2a02b2ffc5bbfaca788b4c27e7f1",
 "bytes": 411,
 "preview": "previews/tile-0087.png",
 "from": "Tiles/tile_0087.png; re-encoded as 8-bit RGBA PNG without metadata",
 "dimension": "2d",
 "category": "picture",
 "describe": "a bearded warrior in a horned iron helmet",
 "tags": [
  "kenney",
  "pixel",
  "top-down",
  "dungeon",
  "character",
  "person",
  "npc",
  "hero",
  "warrior",
  "viking",
  "dwarf",
  "helmet",
  "horns",
  "beard",
  "fighter"
 ],
 "use": {
  "texelsPerMetre": 16,
  "style": "pixel"
 },
 "budgets": {
  "textures": 1,
  "textureMax": 16
 },
 "validated": [
  {
   "by": "flat-judge",
   "version": "gf-flat-1",
   "ok": true,
   "date": "2026-10-13",
   "report": {
    "facts": {
     "cell": 16
    }
   }
  }
 ],
 "fits": {
  "signature": {
   "measured": "2026-10-13",
   "tool": "art ingest 1",
   "palette": {
    "size": 6,
    "hues": [
     "#3f2631",
     "#c0cbdc",
     "#bd6c4a",
     "#8b9bb4",
     "#eaa56c",
     "#262b44",
     "#52607c",
     "#f7c282"
    ],
    "saturation": 0.311,
    "value": 0.421,
    "families": [
     {
      "hue": "pink",
      "share": 0.505
     },
     {
      "hue": "blue",
      "share": 0.31
     },
     {
      "hue": "orange",
      "share": 0.185
     }
    ],
    "exact": 9,
    "grey": 0
   },
   "texelsPerMetre": 16,
   "outline": {
    "present": true,
    "how": "ink",
    "share": 0.923
   }
  }
 },
 "source": {
  "sha256": "321ecd683c4e542e09d368709e75821b8b823b7b98b71bebb39d66cead951315",
  "modified": "re-encoded as 8-bit RGBA PNG without metadata",
  "retrieved": "2026-10-13"
 }
}
