{
 "assetVersion": 1,
 "id": "character-maleperson-back",
 "pack": "kenney-toon-characters",
 "file": "character-maleperson-back.png",
 "sha256": "b99ca488638e50c79fe90bc910e9435242b55208549f08f0861ad98c7ebbd7b9",
 "bytes": 5662,
 "preview": "previews/character-maleperson-back.png",
 "from": "Male person/PNG/Poses/character_malePerson_back.png; re-encoded as 8-bit RGBA PNG without metadata",
 "dimension": "2d",
 "category": "picture",
 "describe": "character maleperson back",
 "tags": [
  "kenney",
  "drawn",
  "character",
  "pose",
  "maleperson",
  "back",
  "male",
  "person",
  "poses"
 ],
 "use": {
  "style": "drawn"
 },
 "budgets": {
  "textures": 1,
  "textureMax": 128
 },
 "validated": [
  {
   "by": "flat-judge",
   "version": "gf-flat-1",
   "ok": true,
   "date": "2026-10-13",
   "report": {
    "facts": {
     "cell": 128
    }
   }
  }
 ],
 "fits": {
  "signature": {
   "measured": "2026-10-13",
   "tool": "art ingest 1",
   "palette": {
    "size": 32,
    "hues": [
     "#3c3e41",
     "#3b3d40",
     "#bf7958",
     "#3a3c3f",
     "#eea160",
     "#393b3d",
     "#ec9f5f",
     "#b97555"
    ],
    "saturation": 0.3,
    "value": 0.473,
    "families": [
     {
      "hue": "grey",
      "share": 0.443
     },
     {
      "hue": "orange",
      "share": 0.443
     },
     {
      "hue": "blue",
      "share": 0.097
     }
    ],
    "exact": 212,
    "grey": 0.443
   },
   "outline": {
    "present": false,
    "share": 0
   }
  }
 },
 "source": {
  "sha256": "81943ccebf3dd9fe4bb1a305fa82d26079195afc469b6570d9ec82b9fac3e9b2",
  "modified": "re-encoded as 8-bit RGBA PNG without metadata",
  "retrieved": "2026-10-13"
 }
}
