{
 "assetVersion": 1,
 "id": "track-wide-straight-skew-right-side",
 "pack": "kenney-toy-car-kit-full",
 "file": "track-wide-straight-skew-right-side.glb",
 "sha256": "58c95780ede3f31baff4c5eb4e2eefb6c9856121d0c2a6cec34e6f368708ab0c",
 "bytes": 15184,
 "preview": "previews/track-wide-straight-skew-right-side.png",
 "from": "Models/GLB format/track-wide-straight-skew-right-side.glb; its texture files packed inside, dedup and prune, meshopt compression",
 "dimension": "3d",
 "category": "prop",
 "describe": "track wide straight skew right side",
 "tags": [
  "track",
  "wide",
  "straight",
  "skew",
  "right",
  "side"
 ],
 "use": {
  "size": [
   2.042,
   2.042,
   4.4
  ],
  "origin": "feet",
  "facing": "+z"
 },
 "budgets": {
  "triangles": 220,
  "textures": 1,
  "textureMax": 512,
  "materials": 1
 },
 "validated": [
  {
   "by": "budget",
   "version": "triangle-budget-1",
   "ok": true,
   "date": "2026-10-14",
   "report": {
    "facts": {
     "triangles": 220,
     "meshes": 1,
     "skins": 0,
     "animations": 0,
     "images": 1,
     "bytes": 15184,
     "role": "prop"
    }
   }
  }
 ],
 "fits": {
  "signature": {
   "measured": "2026-10-14",
   "tool": "art ingest 1",
   "palette": {
    "size": 3,
    "hues": [
     "#ff8144",
     "#ff7544",
     "#ff8d44",
     "#ff9a44",
     "#ff8f44",
     "#ff8a44",
     "#ff7944",
     "#ff7e44"
    ],
    "saturation": 0.994,
    "value": 0.633,
    "families": [
     {
      "hue": "orange",
      "share": 0.988
     }
    ],
    "grey": 0
   },
   "trianglesPerMetre": 3.17,
   "texturedShare": 0,
   "textured": false,
   "outline": {
    "present": false,
    "share": 0
   }
  }
 },
 "source": {
  "sha256": "dffbfb889c99b3e8db79eae4c08a1fe92b06b3817a2c7c142f2f96788e0579ba",
  "modified": "its texture files packed inside, dedup and prune, meshopt compression",
  "retrieved": "2026-10-14"
 }
}
