{
 "assetVersion": 1,
 "id": "sign-left",
 "pack": "kenney-new-platformer-pack",
 "file": "sign-left.png",
 "sha256": "f88453aeefc64f877177e74c6d238141fd25b4230aef0b1e912dbf80801fc5a2",
 "bytes": 2462,
 "preview": "previews/sign-left.png",
 "from": "Sprites/Tiles/Double/sign_left.png; re-encoded as 8-bit RGBA PNG without metadata",
 "dimension": "2d",
 "category": "picture",
 "describe": "sign left",
 "tags": [
  "kenney",
  "drawn",
  "platformer",
  "side",
  "sign",
  "left",
  "tiles"
 ],
 "use": {
  "texelsPerMetre": 128,
  "style": "drawn"
 },
 "budgets": {
  "textures": 1,
  "textureMax": 128
 },
 "validated": [
  {
   "by": "flat-judge",
   "version": "gf-flat-1",
   "ok": true,
   "date": "2026-10-13",
   "report": {
    "facts": {
     "cell": 128
    }
   }
  }
 ],
 "fits": {
  "signature": {
   "measured": "2026-10-13",
   "tool": "art ingest 1",
   "palette": {
    "size": 4,
    "hues": [
     "#de7e4f",
     "#353541",
     "#c66a3e",
     "#fa9f72",
     "#aa5e39",
     "#343440",
     "#353540",
     "#3f3941"
    ],
    "saturation": 0.531,
    "value": 0.494,
    "families": [
     {
      "hue": "orange",
      "share": 0.736
     },
     {
      "hue": "grey",
      "share": 0.259
     }
    ],
    "exact": 62,
    "grey": 0.259
   },
   "texelsPerMetre": 128,
   "outline": {
    "present": true,
    "how": "ink",
    "share": 0.914
   }
  }
 },
 "source": {
  "sha256": "5bf077ab3cdcff4a996660d8751ecf083ad28b458115e1d54d1f31f2f5643f51",
  "modified": "re-encoded as 8-bit RGBA PNG without metadata",
  "retrieved": "2026-10-13"
 }
}
