{
 "assetVersion": 1,
 "id": "character-c",
 "pack": "kenney-blocky-characters",
 "file": "character-c.glb",
 "sha256": "1d1591a80973dad85dcf44317e539d1b186e8a53c31412151aed107a536bc93f",
 "bytes": 36608,
 "preview": "previews/character-c.png",
 "from": "Models/GLB format/character-c.glb; its texture files packed inside, put on gf-humanoid-1 (builder/art/rig/kenney-blocky.mjs: T-posed, rigid toy segments, 1.62 m), dedup and prune, meshopt compression",
 "dimension": "3d",
 "category": "body",
 "describe": "a bald man with a moustache in a green t-shirt with a game-pad print",
 "tags": [
  "man",
  "bald",
  "gamer",
  "casual",
  "green",
  "kenney",
  "blocky",
  "block",
  "voxel",
  "character",
  "player"
 ],
 "use": {
  "size": [
   1.8,
   1.62,
   0.48
  ],
  "height": 1.62,
  "rig": "gf-humanoid-1",
  "origin": "feet",
  "facing": "+z",
  "clips": "humanoid-clips/gf-humanoid-1",
  "sockets": [
   "head",
   "hand_r",
   "hand_l",
   "back"
  ]
 },
 "budgets": {
  "triangles": 464,
  "textures": 1,
  "textureMax": 1024,
  "materials": 1,
  "joints": 23
 },
 "validated": [
  {
   "by": "rig-check",
   "version": "gf-humanoid-1",
   "ok": true,
   "date": "2026-10-13",
   "report": {
    "facts": {
     "height": 1.62,
     "triangles": 464,
     "joints": 23,
     "materials": 1
    }
   }
  }
 ],
 "fits": {
  "signature": {
   "measured": "2026-10-13",
   "tool": "art ingest 1",
   "palette": {
    "size": 13,
    "hues": [
     "#f6d1a5",
     "#44ae7d",
     "#de875f",
     "#e79a76",
     "#f1c79b",
     "#42a979",
     "#e5ab80",
     "#de916e"
    ],
    "saturation": 0.626,
    "value": 0.645,
    "families": [
     {
      "hue": "orange",
      "share": 0.759
     },
     {
      "hue": "green",
      "share": 0.234
     }
    ],
    "grey": 0.004
   },
   "trianglesPerMetre": 7.31,
   "texelsPerMetre": 221,
   "texturedShare": 0.877,
   "textured": true,
   "outline": {
    "present": false,
    "share": 0
   },
   "proportions": "3.29 heads tall; hips at 37% of the height; shoulders 44% of it",
   "body": {
    "headsTall": 3.29,
    "hipShare": 0.37,
    "shoulderShare": 0.444,
    "widthShare": 1.111
   }
  }
 },
 "source": {
  "sha256": "ad2425ba0da5d9adff791b949bd62389ddcb09963ff89265930eab0d6484398c",
  "modified": "its texture files packed inside, put on gf-humanoid-1 (builder/art/rig/kenney-blocky.mjs: T-posed, rigid toy segments, 1.62 m), dedup and prune, meshopt compression",
  "retrieved": "2026-10-13"
 }
}
