{
 "assetVersion": 1,
 "id": "tile-0036",
 "pack": "kenney-tiny-town",
 "file": "tile-0036.png",
 "sha256": "36ff5a14ff5274451fa4799dac7c5d2783f2cdaa9429f9ccf6bae360eb97c596",
 "bytes": 212,
 "preview": "previews/tile-0036.png",
 "from": "Tiles/tile_0036.png; re-encoded as 8-bit RGBA PNG without metadata",
 "dimension": "2d",
 "category": "tile",
 "describe": "the south-west corner of a bare dirt patch in grass",
 "tags": [
  "kenney",
  "pixel",
  "top-down",
  "town",
  "dirt",
  "path",
  "ground",
  "grass",
  "border",
  "corner",
  "corner-outer-sw"
 ],
 "use": {
  "texelsPerMetre": 16,
  "style": "pixel",
  "tile": false
 },
 "budgets": {
  "textures": 1,
  "textureMax": 16
 },
 "validated": [
  {
   "by": "flat-judge",
   "version": "gf-flat-1",
   "ok": true,
   "date": "2026-10-13",
   "report": {
    "facts": {
     "cell": 16,
     "frames": 1
    }
   }
  }
 ],
 "fits": {
  "signature": {
   "measured": "2026-10-13",
   "tool": "art ingest 1",
   "palette": {
    "size": 2,
    "hues": [
     "#eaa56c",
     "#84c669",
     "#fec99c",
     "#cf8254",
     "#65a556"
    ],
    "saturation": 0.633,
    "value": 0.641,
    "families": [
     {
      "hue": "orange",
      "share": 0.613
     },
     {
      "hue": "green",
      "share": 0.387
     }
    ],
    "exact": 5,
    "grey": 0
   },
   "texelsPerMetre": 16,
   "outline": {
    "present": false,
    "share": 0
   }
  }
 },
 "source": {
  "sha256": "87f81fe427117ff6fcee2cf40c1b30688e7bcea78cc2933c7354c9d985ffffac",
  "modified": "re-encoded as 8-bit RGBA PNG without metadata",
  "retrieved": "2026-10-13"
 }
}
