{
 "assetVersion": 1,
 "id": "character-femaleperson-rope",
 "pack": "kenney-toon-characters",
 "file": "character-femaleperson-rope.png",
 "sha256": "edd3b50c2ec9c348ce76632181cd6329f4ce534d9263afb53b1883ea78edd7fd",
 "bytes": 7545,
 "preview": "previews/character-femaleperson-rope.png",
 "from": "Female person/PNG/Poses/character_femalePerson_rope.png; re-encoded as 8-bit RGBA PNG without metadata",
 "dimension": "2d",
 "category": "picture",
 "describe": "character femaleperson rope",
 "tags": [
  "kenney",
  "drawn",
  "character",
  "pose",
  "femaleperson",
  "rope",
  "female",
  "person",
  "poses"
 ],
 "use": {
  "style": "drawn"
 },
 "budgets": {
  "textures": 1,
  "textureMax": 128
 },
 "validated": [
  {
   "by": "flat-judge",
   "version": "gf-flat-1",
   "ok": true,
   "date": "2026-10-13",
   "report": {
    "facts": {
     "cell": 128
    }
   }
  }
 ],
 "fits": {
  "signature": {
   "measured": "2026-10-13",
   "tool": "art ingest 1",
   "palette": {
    "size": 53,
    "hues": [
     "#3c3e41",
     "#bf7958",
     "#71a2be",
     "#bc7756",
     "#3b3d40",
     "#bd7857",
     "#ad6e50",
     "#b97555"
    ],
    "saturation": 0.301,
    "value": 0.474,
    "families": [
     {
      "hue": "orange",
      "share": 0.391
     },
     {
      "hue": "grey",
      "share": 0.318
     },
     {
      "hue": "green",
      "share": 0.155
     },
     {
      "hue": "blue",
      "share": 0.066
     },
     {
      "hue": "cyan",
      "share": 0.039
     }
    ],
    "exact": 215,
    "grey": 0.318
   },
   "outline": {
    "present": false,
    "share": 0.018
   }
  }
 },
 "source": {
  "sha256": "fe7082143a0634617bb2d2c7d394393295740f85f4c74f23bdc68112b891e4ce",
  "modified": "re-encoded as 8-bit RGBA PNG without metadata",
  "retrieved": "2026-10-13"
 }
}
