{
 "assetVersion": 1,
 "id": "sign",
 "pack": "kenney-new-platformer-pack",
 "file": "sign.png",
 "sha256": "415881621c1df3599090186914f6565b6c512598ace1ecb718b7beee3ece4955",
 "bytes": 2306,
 "preview": "previews/sign.png",
 "from": "Sprites/Tiles/Double/sign.png; re-encoded as 8-bit RGBA PNG without metadata",
 "dimension": "2d",
 "category": "tile",
 "describe": "sign tile",
 "tags": [
  "kenney",
  "drawn",
  "platformer",
  "side",
  "sign",
  "tiles"
 ],
 "use": {
  "texelsPerMetre": 128,
  "style": "drawn",
  "tile": true
 },
 "budgets": {
  "textures": 1,
  "textureMax": 128
 },
 "validated": [
  {
   "by": "flat-judge",
   "version": "gf-flat-1",
   "ok": true,
   "date": "2026-10-13",
   "report": {
    "warnings": [
     "fill: the top and bottom edges do not continue each other (the step across the wrap is 13.3 times the step inside the tile; at most 3)"
    ],
    "facts": {
     "cell": 128,
     "frames": 1
    }
   }
  }
 ],
 "fits": {
  "signature": {
   "measured": "2026-10-13",
   "tool": "art ingest 1",
   "palette": {
    "size": 4,
    "hues": [
     "#de7e4f",
     "#353541",
     "#c66a3e",
     "#fa9f72",
     "#aa5e39",
     "#343440",
     "#353540",
     "#cd7043"
    ],
    "saturation": 0.534,
    "value": 0.496,
    "families": [
     {
      "hue": "orange",
      "share": 0.743
     },
     {
      "hue": "grey",
      "share": 0.255
     }
    ],
    "exact": 55,
    "grey": 0.255
   },
   "texelsPerMetre": 128,
   "outline": {
    "present": true,
    "how": "ink",
    "share": 0.929
   }
  }
 },
 "source": {
  "sha256": "558ed2bac2fdab9d39876e85ddf39f3fe313b9c5fc8ed9ca4ad8c16fb9c2a7e5",
  "modified": "re-encoded as 8-bit RGBA PNG without metadata",
  "retrieved": "2026-10-13"
 }
}
