{
 "assetVersion": 1,
 "id": "character-maleperson-hold",
 "pack": "kenney-toon-characters",
 "file": "character-maleperson-hold.png",
 "sha256": "0ac5b054808a60a4bef12a92831d956fa66ad63263abf50657d17982e46b55c0",
 "bytes": 6080,
 "preview": "previews/character-maleperson-hold.png",
 "from": "Male person/PNG/Poses/character_malePerson_hold.png; re-encoded as 8-bit RGBA PNG without metadata",
 "dimension": "2d",
 "category": "picture",
 "describe": "character maleperson hold",
 "tags": [
  "kenney",
  "drawn",
  "character",
  "pose",
  "maleperson",
  "hold",
  "male",
  "person",
  "poses"
 ],
 "use": {
  "style": "drawn"
 },
 "budgets": {
  "textures": 1,
  "textureMax": 128
 },
 "validated": [
  {
   "by": "flat-judge",
   "version": "gf-flat-1",
   "ok": true,
   "date": "2026-10-13",
   "report": {
    "facts": {
     "cell": 128
    }
   }
  }
 ],
 "fits": {
  "signature": {
   "measured": "2026-10-13",
   "tool": "art ingest 1",
   "palette": {
    "size": 51,
    "hues": [
     "#3c3e41",
     "#bf7958",
     "#be7857",
     "#3b3d40",
     "#3a3c3f",
     "#bc7756",
     "#b97555",
     "#b87454"
    ],
    "saturation": 0.279,
    "value": 0.492,
    "families": [
     {
      "hue": "orange",
      "share": 0.434
     },
     {
      "hue": "grey",
      "share": 0.392
     },
     {
      "hue": "blue",
      "share": 0.14
     },
     {
      "hue": "brown",
      "share": 0.03
     }
    ],
    "exact": 215,
    "grey": 0.392
   },
   "outline": {
    "present": false,
    "share": 0
   }
  }
 },
 "source": {
  "sha256": "489b1d065482bc52bcec82a1f891e5829713e883119e5127260899f2ede6f815",
  "modified": "re-encoded as 8-bit RGBA PNG without metadata",
  "retrieved": "2026-10-13"
 }
}
