{
 "assetVersion": 1,
 "id": "terrain-dirt-ramp-short-b",
 "pack": "kenney-new-platformer-pack",
 "file": "terrain-dirt-ramp-short-b.png",
 "sha256": "7c001ad9ad0d1afa67b59c38fc531c881242ad83cfd20c2354a814b0ec9ba1ad",
 "bytes": 1270,
 "preview": "previews/terrain-dirt-ramp-short-b.png",
 "from": "Sprites/Tiles/Double/terrain_dirt_ramp_short_b.png; re-encoded as 8-bit RGBA PNG without metadata",
 "dimension": "2d",
 "category": "picture",
 "describe": "terrain dirt ramp short",
 "tags": [
  "kenney",
  "drawn",
  "platformer",
  "side",
  "terrain",
  "dirt",
  "ramp",
  "short",
  "tiles"
 ],
 "use": {
  "texelsPerMetre": 128,
  "style": "drawn"
 },
 "budgets": {
  "textures": 1,
  "textureMax": 128
 },
 "validated": [
  {
   "by": "flat-judge",
   "version": "gf-flat-1",
   "ok": true,
   "date": "2026-10-13",
   "report": {
    "facts": {
     "cell": 128
    }
   }
  }
 ],
 "fits": {
  "signature": {
   "measured": "2026-10-13",
   "tool": "art ingest 1",
   "palette": {
    "size": 7,
    "hues": [
     "#de7e4f",
     "#cfd5da",
     "#bbc4cb",
     "#353541",
     "#ee9366",
     "#c66a3e",
     "#a6b2bb",
     "#7a584e"
    ],
    "saturation": 0.442,
    "value": 0.617,
    "families": [
     {
      "hue": "orange",
      "share": 0.564
     },
     {
      "hue": "grey",
      "share": 0.421
     }
    ],
    "exact": 39,
    "grey": 0.421
   },
   "texelsPerMetre": 128,
   "outline": {
    "present": false,
    "share": 0.368
   }
  }
 },
 "source": {
  "sha256": "8e0e0a3d3030a5cea51297df0073737f30ee7a55475d3c9d44b1ef5d3017bad5",
  "modified": "re-encoded as 8-bit RGBA PNG without metadata",
  "retrieved": "2026-10-13"
 }
}
